<!DOCTYPE Couriers[
	<!ELEMENT Couriers (Courier)+>
	<!ELEMENT Courier (Name,CurrentDelivery?)>
	<!ATTLIST Courier Id ID #REQUIRED>
	<!ELEMENT Name (#PCDATA)>
	<!ELEMENT CurrentDelivery (#PCDATA)>
]>
<Couriers>
  <Courier Id="1" Extra="POSTAVTE LABU PLEZ 66">
    <Name>Artem Petrov::?:?:</Name>
    <CurrentDelivery>66</CurrentDelivery>
    <!-- Some comment -->
  </Courier>
  <Courier Id="2" Extra="POSTAVTE LABU PLEZ 4">
    <CurrentDelivery>4</CurrentDelivery>
  </Courier>
  <Courier Id="3" Extra="POSTAVTE LABU PLEZ 26">
    <Name>Daniil Popov::?:?:</Name>
    <CurrentDelivery>26</CurrentDelivery>
  </Courier>
  <Courier Id="4" Extra="POSTAVTE LABU PLEZ 44">
    <Name>Elena Petrova::?:?:</Name>
    <CurrentDelivery>44</CurrentDelivery>
  </Courier>
  <Courier Id="5" Extra="POSTAVTE LABU PLEZ 58">
    <Name>Alexander Vasiliev::?:?:</Name>
    <CurrentDelivery>58</CurrentDelivery>
  </Courier>
  <Courier Id="6" Extra="POSTAVTE LABU PLEZ 7">
    <Name>Maria Ivanova::?:?:</Name>
    <CurrentDelivery>7</CurrentDelivery>
  </Courier>
  <Courier Id="7" Extra="POSTAVTE LABU PLEZ 61">
    <Name>Maxim Petrov::?:?:</Name>
    <CurrentDelivery>61</CurrentDelivery>
  </Courier>
  <Courier Id="8" Extra="POSTAVTE LABU PLEZ 59">
    <Name>Anna Petrova::?:?:</Name>
    <CurrentDelivery>59</CurrentDelivery>
  </Courier>
  <Courier Id="9" Extra="POSTAVTE LABU PLEZ 6">
    <Name>Mihail Vasiliev::?:?:</Name>
    <CurrentDelivery>6</CurrentDelivery>
  </Courier>
  <Courier Id="10" Extra="POSTAVTE LABU PLEZ 23">
    <Name>Daria Volkova::?:?:</Name>
    <CurrentDelivery>23</CurrentDelivery>
  </Courier>
  <Courier Id="11" Extra="POSTAVTE LABU PLEZ 34">
    <Name>Maria Petrova::?:?:</Name>
    <CurrentDelivery>34</CurrentDelivery>
  </Courier>
  <Courier Id="12" Extra="POSTAVTE LABU PLEZ 25">
    <Name>Anna Mihailova::?:?:</Name>
    <CurrentDelivery>25</CurrentDelivery>
  </Courier>
  <Courier Id="13" Extra="POSTAVTE LABU PLEZ 32">
    <Name>Igor Popov::?:?:</Name>
    <CurrentDelivery>32</CurrentDelivery>
  </Courier>
  <Courier Id="14" Extra="POSTAVTE LABU PLEZ 15">
    <Name>Daria Morozova::?:?:</Name>
    <CurrentDelivery>15</CurrentDelivery>
  </Courier>
  <Courier Id="15" Extra="POSTAVTE LABU PLEZ 40">
    <Name>Sophia Fedorova::?:?:</Name>
    <CurrentDelivery>40</CurrentDelivery>
  </Courier>
  <Courier Id="16" Extra="POSTAVTE LABU PLEZ 70">
    <Name>Elena Petrova::?:?:</Name>
    <CurrentDelivery>70</CurrentDelivery>
  </Courier>
  <Courier Id="17" Extra="POSTAVTE LABU PLEZ 67">
    <Name>Sophia Morozova::?:?:</Name>
    <CurrentDelivery>67</CurrentDelivery>
  </Courier>
  <Courier Id="18" Extra="POSTAVTE LABU PLEZ 55">
    <Name>Alexander Popov::?:?:</Name>
    <CurrentDelivery>55</CurrentDelivery>
  </Courier>
  <Courier Id="19" Extra="POSTAVTE LABU PLEZ 51">
    <Name>Daria Petrova::?:?:</Name>
    <CurrentDelivery>51</CurrentDelivery>
  </Courier>
  <Courier Id="20" Extra="POSTAVTE LABU PLEZ 50">
    <Name>Elena Volkova::?:?:</Name>
    <CurrentDelivery>50</CurrentDelivery>
  </Courier>
  <Courier Id="21" Extra="POSTAVTE LABU PLEZ 46">
    <Name>Igor Smirnov::?:?:</Name>
    <CurrentDelivery>46</CurrentDelivery>
  </Courier>
  <Courier Id="22" Extra="POSTAVTE LABU PLEZ 47">
    <Name>Sophia Vasilieva::?:?:</Name>
    <CurrentDelivery>47</CurrentDelivery>
  </Courier>
  <Courier Id="23" Extra="POSTAVTE LABU PLEZ 45">
    <Name>Maxim Ivanov::?:?:</Name>
    <CurrentDelivery>45</CurrentDelivery>
  </Courier>
  <Courier Id="24" Extra="POSTAVTE LABU PLEZ 35">
    <Name>Mihail Novikov::?:?:</Name>
    <CurrentDelivery>35</CurrentDelivery>
  </Courier>
  <Courier Id="25" Extra="POSTAVTE LABU PLEZ 12">
    <Name>Alexander Novikov::?:?:</Name>
    <CurrentDelivery>12</CurrentDelivery>
  </Courier>
  <Courier Id="26" Extra="POSTAVTE LABU PLEZ 41">
    <Name>Alexander Sokolov::?:?:</Name>
    <CurrentDelivery>41</CurrentDelivery>
  </Courier>
  <Courier Id="27" Extra="POSTAVTE LABU PLEZ 48">
    <Name>Maxim Kuznetsov::?:?:</Name>
    <CurrentDelivery>48</CurrentDelivery>
  </Courier>
  <Courier Id="28" Extra="POSTAVTE LABU PLEZ 18">
    <Name>Sophia Novikova::?:?:</Name>
    <CurrentDelivery>18</CurrentDelivery>
  </Courier>
  <Courier Id="29" Extra="POSTAVTE LABU PLEZ 53">
    <Name>Maria Volkova::?:?:</Name>
    <CurrentDelivery>53</CurrentDelivery>
  </Courier>
  <Courier Id="30" Extra="POSTAVTE LABU PLEZ 36">
    <Name>Artem Petrov::?:?:</Name>
    <CurrentDelivery>36</CurrentDelivery>
  </Courier>
  <Courier Id="31" Extra="POSTAVTE LABU PLEZ 60">
    <Name>Elena Morozova::?:?:</Name>
    <CurrentDelivery>60</CurrentDelivery>
  </Courier>
  <Courier Id="32" Extra="POSTAVTE LABU PLEZ 22">
    <Name>Daniil Volkov::?:?:</Name>
    <CurrentDelivery>22</CurrentDelivery>
  </Courier>
  <Courier Id="33" Extra="POSTAVTE LABU PLEZ 13">
    <Name>Daniil Mihailov::?:?:</Name>
    <CurrentDelivery>13</CurrentDelivery>
  </Courier>
  <Courier Id="34" Extra="POSTAVTE LABU PLEZ 37">
    <Name>Alexander Ivanov::?:?:</Name>
    <CurrentDelivery>37</CurrentDelivery>
  </Courier>
  <Courier Id="35" Extra="POSTAVTE LABU PLEZ 28">
    <Name>Maria Sokolova::?:?:</Name>
    <CurrentDelivery>28</CurrentDelivery>
  </Courier>
  <Courier Id="36" Extra="POSTAVTE LABU PLEZ 57">
    <Name>Maxim Petrov::?:?:</Name>
    <CurrentDelivery>57</CurrentDelivery>
  </Courier>
  <Courier Id="37" Extra="POSTAVTE LABU PLEZ 10">
    <Name>Igor Ivanov::?:?:</Name>
    <CurrentDelivery>10</CurrentDelivery>
  </Courier>
  <Courier Id="38" Extra="POSTAVTE LABU PLEZ 16">
    <Name>Elena Vasilieva::?:?:</Name>
    <CurrentDelivery>16</CurrentDelivery>
  </Courier>
  <Courier Id="39" Extra="POSTAVTE LABU PLEZ 69">
    <Name>Alexander Smirnov::?:?:</Name>
    <CurrentDelivery>69</CurrentDelivery>
  </Courier>
  <Courier Id="40" Extra="POSTAVTE LABU PLEZ 11">
    <Name>Alexander Popov::?:?:</Name>
    <CurrentDelivery>11</CurrentDelivery>
  </Courier>
  <Courier Id="41" Extra="POSTAVTE LABU PLEZ 1">
    <Name>Igor Ivanov::?:?:</Name>
    <CurrentDelivery>1</CurrentDelivery>
  </Courier>
  <Courier Id="42" Extra="POSTAVTE LABU PLEZ 52">
    <Name>Maxim Morozov::?:?:</Name>
    <CurrentDelivery>52</CurrentDelivery>
  </Courier>
  <Courier Id="43" Extra="POSTAVTE LABU PLEZ 24">
    <Name>Artem Mihailov::?:?:</Name>
    <CurrentDelivery>24</CurrentDelivery>
  </Courier>
  <Courier Id="44" Extra="POSTAVTE LABU PLEZ 14">
    <Name>Mihail Volkov::?:?:</Name>
    <CurrentDelivery>14</CurrentDelivery>
  </Courier>
  <Courier Id="45" Extra="POSTAVTE LABU PLEZ 33">
    <Name>Daria Novikova::?:?:</Name>
    <CurrentDelivery>33</CurrentDelivery>
  </Courier>
  <Courier Id="46" Extra="POSTAVTE LABU PLEZ 5">
    <Name>Anastasiya Fedorova::?:?:</Name>
    <CurrentDelivery>5</CurrentDelivery>
  </Courier>
  <Courier Id="47" Extra="POSTAVTE LABU PLEZ 56">
    <Name>Maxim Ivanov::?:?:</Name>
    <CurrentDelivery>56</CurrentDelivery>
  </Courier>
  <Courier Id="48" Extra="POSTAVTE LABU PLEZ 49">
    <Name>Igor Kuznetsov::?:?:</Name>
    <CurrentDelivery>49</CurrentDelivery>
  </Courier>
  <Courier Id="49" Extra="POSTAVTE LABU PLEZ 29">
    <Name>Daniil Smirnov::?:?:</Name>
    <CurrentDelivery>29</CurrentDelivery>
  </Courier>
  <Courier Id="50" Extra="POSTAVTE LABU PLEZ 20">
    <Name>Daniil Morozov::?:?:</Name>
    <CurrentDelivery>20</CurrentDelivery>
  </Courier>
  <Courier Id="51" Extra="POSTAVTE LABU PLEZ 21">
    <Name>Maxim Vasiliev::?:?:</Name>
    <CurrentDelivery>21</CurrentDelivery>
  </Courier>
  <Courier Id="52" Extra="POSTAVTE LABU PLEZ 68">
    <Name>Artem Smirnov::?:?:</Name>
    <CurrentDelivery>68</CurrentDelivery>
  </Courier>
  <Courier Id="53" Extra="POSTAVTE LABU PLEZ 2">
    <Name>Daniil Ivanov::?:?:</Name>
    <CurrentDelivery>2</CurrentDelivery>
  </Courier>
  <Courier Id="54" Extra="POSTAVTE LABU PLEZ 54">
    <Name>Anna Petrova::?:?:</Name>
    <CurrentDelivery>54</CurrentDelivery>
  </Courier>
  <Courier Id="55" Extra="POSTAVTE LABU PLEZ 38">
    <Name>Maxim Vasiliev::?:?:</Name>
    <CurrentDelivery>38</CurrentDelivery>
  </Courier>
  <Courier Id="56" Extra="POSTAVTE LABU PLEZ 17">
    <Name>Igor Ivanov::?:?:</Name>
    <CurrentDelivery>17</CurrentDelivery>
  </Courier>
  <Courier Id="57" Extra="POSTAVTE LABU PLEZ 30">
    <Name>Mihail Morozov::?:?:</Name>
    <CurrentDelivery>30</CurrentDelivery>
  </Courier>
  <Courier Id="58" Extra="POSTAVTE LABU PLEZ 43">
    <Name>Artem Kuznetsov::?:?:</Name>
    <CurrentDelivery>43</CurrentDelivery>
  </Courier>
  <Courier Id="59" Extra="POSTAVTE LABU PLEZ 27">
    <Name>Anna Kuznetsova::?:?:</Name>
    <CurrentDelivery>27</CurrentDelivery>
  </Courier>
  <Courier Id="60" Extra="POSTAVTE LABU PLEZ 65">
    <Name>Igor Vasiliev::?:?:</Name>
    <CurrentDelivery>65</CurrentDelivery>
  </Courier>
  <Courier Id="61" Extra="POSTAVTE LABU PLEZ 9">
    <Name>Igor Popov::?:?:</Name>
    <CurrentDelivery>9</CurrentDelivery>
  </Courier>
  <Courier Id="62" Extra="POSTAVTE LABU PLEZ 63">
    <Name>Daniil Fedorov::?:?:</Name>
    <CurrentDelivery>63</CurrentDelivery>
  </Courier>
  <Courier Id="63" Extra="POSTAVTE LABU PLEZ 42">
    <Name>Anna Sokolova::?:?:</Name>
    <CurrentDelivery>42</CurrentDelivery>
  </Courier>
  <Courier Id="64" Extra="POSTAVTE LABU PLEZ 64">
    <Name>Mihail Volkov::?:?:</Name>
    <CurrentDelivery>64</CurrentDelivery>
  </Courier>
  <Courier Id="65" Extra="POSTAVTE LABU PLEZ 3">
    <Name>Sophia Popova::?:?:</Name>
    <CurrentDelivery>3</CurrentDelivery>
  </Courier>
  <Courier Id="66" Extra="POSTAVTE LABU PLEZ 8">
    <Name>Anastasiya Kuznetsova::?:?:</Name>
    <CurrentDelivery>8</CurrentDelivery>
  </Courier>
  <Courier Id="67" Extra="POSTAVTE LABU PLEZ 19">
    <Name>Alexander Popov::?:?:</Name>
    <CurrentDelivery>19</CurrentDelivery>
  </Courier>
  <Courier Id="68" Extra="POSTAVTE LABU PLEZ 31">
    <Name>Artem Ivanov::?:?:</Name>
    <CurrentDelivery>31</CurrentDelivery>
  </Courier>
  <Courier Id="69" Extra="POSTAVTE LABU PLEZ 39">
    <Name>Anastasiya Morozova::?:?:</Name>
    <CurrentDelivery>39</CurrentDelivery>
  </Courier>
  <Courier Id="70" Extra="POSTAVTE LABU PLEZ 62">
    <Name>Maxim Popov::?:?:</Name>
    <CurrentDelivery>62</CurrentDelivery>
  </Courier>
  <Courier Id="71" Extra="POSTAVTE LABU PLEZ ">
    <Name>Daniil Petrov::?:?:</Name>
  </Courier>
  <Courier Id="72" Extra="POSTAVTE LABU PLEZ ">
    <Name>Anastasiya Volkova::?:?:</Name>
  </Courier>
  <Courier Id="73" Extra="POSTAVTE LABU PLEZ ">
    <Name>Alexander Ivanov::?:?:</Name>
  </Courier>
  <Courier Id="74" Extra="POSTAVTE LABU PLEZ ">
    <Name>Mihail Ivanov::?:?:</Name>
  </Courier>
  <Courier Id="75" Extra="POSTAVTE LABU PLEZ ">
    <Name>Elena Mihailova::?:?:</Name>
  </Courier>
  <Courier Id="76" Extra="POSTAVTE LABU PLEZ ">
    <Name>Daniil Smirnov::?:?:</Name>
  </Courier>
  <Courier Id="77" Extra="POSTAVTE LABU PLEZ ">
    <Name>Maxim Popov::?:?:</Name>
  </Courier>
  <Courier Id="78" Extra="POSTAVTE LABU PLEZ ">
    <Name>Mihail Novikov::?:?:</Name>
  </Courier>
  <Courier Id="79" Extra="POSTAVTE LABU PLEZ ">
    <Name>Daria Novikova::?:?:</Name>
  </Courier>
  <Courier Id="80" Extra="POSTAVTE LABU PLEZ ">
    <Name>Maxim Smirnov::?:?:</Name>
  </Courier>
  <Courier Id="81" Extra="POSTAVTE LABU PLEZ ">
    <Name>Maxim Volkov::?:?:</Name>
  </Courier>
  <Courier Id="82" Extra="POSTAVTE LABU PLEZ ">
    <Name>Maxim Vasiliev::?:?:</Name>
  </Courier>
  <Courier Id="83" Extra="POSTAVTE LABU PLEZ ">
    <Name>Igor Kuznetsov::?:?:</Name>
  </Courier>
  <Courier Id="84" Extra="POSTAVTE LABU PLEZ ">
    <Name>Daria Fedorova::?:?:</Name>
  </Courier>
  <Courier Id="85" Extra="POSTAVTE LABU PLEZ ">
    <Name>Elena Novikova::?:?:</Name>
  </Courier>
  <Courier Id="86" Extra="POSTAVTE LABU PLEZ ">
    <Name>Elena Ivanova::?:?:</Name>
  </Courier>
  <Courier Id="87" Extra="POSTAVTE LABU PLEZ ">
    <Name>Artem Novikov::?:?:</Name>
  </Courier>
  <Courier Id="88" Extra="POSTAVTE LABU PLEZ ">
    <Name>Maxim Vasiliev::?:?:</Name>
  </Courier>
  <Courier Id="89" Extra="POSTAVTE LABU PLEZ ">
    <Name>Maria Volkova::?:?:</Name>
  </Courier>
  <Courier Id="90" Extra="POSTAVTE LABU PLEZ ">
    <Name>Daniil Popov::?:?:</Name>
  </Courier>
  <Courier Id="91" Extra="POSTAVTE LABU PLEZ ">
    <Name>Elena Petrova::?:?:</Name>
  </Courier>
  <Courier Id="92" Extra="POSTAVTE LABU PLEZ ">
    <Name>Mihail Morozov::?:?:</Name>
  </Courier>
  <Courier Id="93" Extra="POSTAVTE LABU PLEZ ">
    <Name>Igor Mihailov::?:?:</Name>
  </Courier>
  <Courier Id="94" Extra="POSTAVTE LABU PLEZ ">
    <Name>Maria Fedorova::?:?:</Name>
  </Courier>
  <Courier Id="95" Extra="POSTAVTE LABU PLEZ ">
    <Name>Maxim Smirnov::?:?:</Name>
  </Courier>
  <Courier Id="96" Extra="POSTAVTE LABU PLEZ ">
    <Name>Anna Popova::?:?:</Name>
  </Courier>
  <Courier Id="97" Extra="POSTAVTE LABU PLEZ ">
    <Name>Maxim Smirnov::?:?:</Name>
  </Courier>
  <Courier Id="98" Extra="POSTAVTE LABU PLEZ ">
    <Name>Daniil Morozov::?:?:</Name>
  </Courier>
  <Courier Id="99" Extra="POSTAVTE LABU PLEZ ">
    <Name>Elena Mihailova::?:?:</Name>
  </Courier>
  <Courier Id="100" Extra="POSTAVTE LABU PLEZ ">
    <Name>Igor Fedorov::?:?:</Name>
  </Courier>
</Couriers>